{
  "$schema": "../../../shared/schemas/02-strategy.schema.json",
  "concept": {
    "one_liner": "2026년 4월 기준, 임신부터 출산 직후까지 임산부가 받을 수 있는 5대 정부지원금을 ‘신청 데드라인 순’으로 정리하는 영상",
    "target_audience": "임신 12주 ~ 출산 후 60일 이내의 25~39세 임산부 본인·배우자, 첫째 출산이 많고 행정용어에 약함",
    "promise": "이 영상 한 편을 보면 받을 수 있는 금액의 합계와 ‘언제까지 신청해야 하는지’가 정확하게 머릿속에 정리된다.",
    "differentiator": "‘2026년 4월 27일 기준’ 날짜 도장을 박고, 각 제도마다 신청 데드라인을 D-day로 시각화. 카페·블로그 글에 없는 ‘데드라인 캘린더’가 우리만의 무기.",
    "tone": ["친근하지만 정확", "행정용어 풀어쓰기", "단정·과장 금지"]
  },
  "titles": [
    {
      "text": "임산부 정부지원금 5가지, 60일 넘기면 100만원 사라집니다 (2026.4 기준)",
      "rationale": "shocking_fact 훅을 그대로 제목에. ‘60일’과 ‘100만원 사라짐’이 부모급여 소급 룰을 정확히 가리킴. 시점 명시로 신뢰성.",
      "ctr_score": 8.5
    },
    {
      "text": "2026년 임산부가 받을 수 있는 모든 정부지원금 총정리 (4월 27일 최신)",
      "rationale": "‘총정리 + 최신 날짜’ 조합으로 검색 의도(2026 임산부 정부지원금)와 정확 일치. 안전한 SEO형.",
      "ctr_score": 8.0
    },
    {
      "text": "임신확인서 한 장으로 받을 수 있는 돈, 최대 1,140만원 (2026)",
      "rationale": "총합 금액(국민행복카드 100 + 첫만남 200 + 부모급여 0세 1,200 — 임신중 시점 기준 일부 합산)을 임팩트 있게. 단, 본문에서 합산 근거를 정확히 풀어야 함.",
      "ctr_score": 8.2
    },
    {
      "text": "출산 전·후 신청 데드라인 5가지 — 놓치면 0원입니다 (2026.4)",
      "rationale": "데드라인 강조 형. ‘0원’이 손실 회피 심리 자극. 자극 강도는 중간(과장 표현 ‘대박’ 등은 회피).",
      "ctr_score": 7.8
    },
    {
      "text": "[2026년 4월 기준] 부모급여·첫만남이용권·국민행복카드, 한 영상으로 끝",
      "rationale": "키워드 3개를 그대로 박아 SEO 강함. ‘한 영상으로 끝’이 한 번에 끝내고픈 시청자 욕구.",
      "ctr_score": 7.5
    },
    {
      "text": "임산부가 모르면 손해 보는 정부지원금 5가지 (2026.4 최신 정리)",
      "rationale": "안전한 일반형. 다만 ‘모르면 손해’는 brand.ban_words 의 자극 카피와 경계라 추천 우선순위는 낮춤.",
      "ctr_score": 7.0
    },
    {
      "text": "쌍둥이 임산부도, 유산·사산도, 외국인도 받을 수 있는 지원금 (2026)",
      "rationale": "차별화 포인트(소수 케이스)를 제목에 박은 변형. 검색량은 낮지만 충성 시청자에 강함. 두 번째 영상 후보.",
      "ctr_score": 6.5
    }
  ],
  "hooks": [
    {
      "text": "출생일로부터 딱 60일. 이 기한을 하루라도 넘기면, 부모급여 100만 원이 그대로 사라집니다.",
      "type": "shocking_fact",
      "rationale": "정책브리핑 공식 ‘60일 소급’ 룰을 정확히 인용. 손실 회피 심리 자극 + 사실 정확."
    },
    {
      "text": "임산부가 받을 수 있는 정부지원금, 도대체 몇 가지일까요? 그리고 그 중 진짜 ‘자동 지급’되는 건 몇 개일까요?",
      "type": "question",
      "rationale": "예상과 달리 대부분 직접 신청해야 한다는 본문 핵심으로 자연스럽게 연결."
    },
    {
      "text": "2026년 4월 기준, 임산부 한 명이 출산 직전까지 받을 수 있는 정부지원금만 합쳐도 200만 원이 넘습니다.",
      "type": "promise",
      "rationale": "구체 금액 + 시점 명시. 약속이 본문에서 검증 가능(국민행복카드 100 + 고위험 등 케이스별)."
    },
    {
      "text": "‘공돈처럼 보이는 정부지원금, 사실 가만히 있으면 0원입니다.’",
      "type": "contradiction",
      "rationale": "공돈 인식을 깨고 ‘직접 신청’이 핵심임을 한 줄로 전달."
    }
  ],
  "intro": {
    "text": "안녕하세요, 엄마지갑입니다. 오늘은 2026년 4월 27일 기준으로, 임신부터 출산 직후까지 임산부가 받을 수 있는 정부지원금 다섯 가지를, 신청 데드라인이 빠른 순서대로 정리해드릴게요. 다섯 개 모두 이름이 비슷해서 헷갈리지만, 사실 각자 신청처도, 사용 기한도, 받는 시점도 다 다릅니다. 하나라도 놓치면 받을 돈을 그냥 흘려보내게 되니까, 끝까지 같이 정리해보세요.",
    "duration_sec": 28,
    "preview_promise": "5개 제도 — 국민행복카드(임신·출산 진료비), 첫만남이용권, 부모급여, 고위험 임산부 의료비, 산모·신생아 건강관리 — 를 데드라인 순으로 정리하고, 마지막에 D-day 캘린더 한 장으로 요약합니다."
  },
  "outro": {
    "cta": "오늘 영상이 도움이 되셨다면 구독과 알림설정 부탁드려요. 다음 영상에서는 ‘출산 후 1년간 받을 수 있는 모든 지원금’ 편으로 이어집니다. 본인이 사는 시·군·구의 추가 출산지원금이 궁금하시면 ‘복지로’에서 거주지 검색해보시는 걸 추천드려요.",
    "next_video_teaser": "다음 영상: ‘출산 후 1년 — 한 번 더 챙겨야 할 지원금 7가지’"
  },
  "keywords": [
    "임산부 정부지원금",
    "2026 임산부 지원금",
    "부모급여 2026",
    "첫만남이용권",
    "국민행복카드",
    "임신출산 진료비",
    "고위험 임산부 의료비",
    "산모 신생아 건강관리",
    "산후도우미",
    "출산지원금",
    "복지로",
    "정부24",
    "임신 바우처",
    "아동수당",
    "행복출산 원스톱"
  ],
  "created_at": "2026-04-27T00:00:00Z"
}
